{
  "version": "cypher-llm-lossless-parse/v1",
  "source": "/* generated by model */\nMATCH (tool:Tool {name: $toolName})-[:`has MD5 hash`]->(hash:Hash)\n// keep the projection exact\nRETURN hash.value AS md5 LIMIT 10;\n",
  "sourceHash": "d8f41444b54973e2bc144b8b162df2d3aac05c3d5ec5529e53234b628f7599c4",
  "fragments": [
    {
      "kind": "statement",
      "span": {
        "start": {
          "offset": 0,
          "line": 0,
          "character": 0
        },
        "end": {
          "offset": 154,
          "line": 3,
          "character": 33
        }
      },
      "text": "/* generated by model */\nMATCH (tool:Tool {name: $toolName})-[:`has MD5 hash`]->(hash:Hash)\n// keep the projection exact\nRETURN hash.value AS md5 LIMIT 10"
    },
    {
      "kind": "terminator",
      "span": {
        "start": {
          "offset": 154,
          "line": 3,
          "character": 33
        },
        "end": {
          "offset": 155,
          "line": 3,
          "character": 34
        }
      },
      "text": ";"
    },
    {
      "kind": "trivia",
      "span": {
        "start": {
          "offset": 155,
          "line": 3,
          "character": 34
        },
        "end": {
          "offset": 156,
          "line": 4,
          "character": 0
        }
      },
      "text": "\n"
    }
  ],
  "trivia": [
    {
      "kind": "block-comment",
      "span": {
        "start": {
          "offset": 0,
          "line": 0,
          "character": 0
        },
        "end": {
          "offset": 24,
          "line": 0,
          "character": 24
        }
      },
      "text": "/* generated by model */"
    },
    {
      "kind": "line-comment",
      "span": {
        "start": {
          "offset": 92,
          "line": 2,
          "character": 0
        },
        "end": {
          "offset": 120,
          "line": 2,
          "character": 28
        }
      },
      "text": "// keep the projection exact"
    }
  ],
  "statements": [
    {
      "index": 0,
      "raw": "/* generated by model */\nMATCH (tool:Tool {name: $toolName})-[:`has MD5 hash`]->(hash:Hash)\n// keep the projection exact\nRETURN hash.value AS md5 LIMIT 10",
      "span": {
        "start": {
          "offset": 0,
          "line": 0,
          "character": 0
        },
        "end": {
          "offset": 154,
          "line": 3,
          "character": 33
        }
      },
      "clauses": [
        {
          "index": 0,
          "kind": "match",
          "keyword": "MATCH",
          "raw": "MATCH (tool:Tool {name: $toolName})-[:`has MD5 hash`]->(hash:Hash)\n// keep the projection exact\n",
          "body": " (tool:Tool {name: $toolName})-[:`has MD5 hash`]->(hash:Hash)\n// keep the projection exact\n",
          "span": {
            "start": {
              "offset": 25,
              "line": 1,
              "character": 0
            },
            "end": {
              "offset": 121,
              "line": 3,
              "character": 0
            }
          },
          "keywordSpan": {
            "start": {
              "offset": 25,
              "line": 1,
              "character": 0
            },
            "end": {
              "offset": 30,
              "line": 1,
              "character": 5
            }
          },
          "bodySpan": {
            "start": {
              "offset": 30,
              "line": 1,
              "character": 5
            },
            "end": {
              "offset": 121,
              "line": 3,
              "character": 0
            }
          },
          "support": "lifted",
          "irPath": "/clauses/0"
        },
        {
          "index": 1,
          "kind": "return",
          "keyword": "RETURN",
          "raw": "RETURN hash.value AS md5 LIMIT 10",
          "body": " hash.value AS md5 LIMIT 10",
          "span": {
            "start": {
              "offset": 121,
              "line": 3,
              "character": 0
            },
            "end": {
              "offset": 154,
              "line": 3,
              "character": 33
            }
          },
          "keywordSpan": {
            "start": {
              "offset": 121,
              "line": 3,
              "character": 0
            },
            "end": {
              "offset": 127,
              "line": 3,
              "character": 6
            }
          },
          "bodySpan": {
            "start": {
              "offset": 127,
              "line": 3,
              "character": 6
            },
            "end": {
              "offset": 154,
              "line": 3,
              "character": 33
            }
          },
          "support": "lifted",
          "irPath": "/clauses/1"
        }
      ],
      "terminator": {
        "kind": "terminator",
        "span": {
          "start": {
            "offset": 154,
            "line": 3,
            "character": 33
          },
          "end": {
            "offset": 155,
            "line": 3,
            "character": 34
          }
        },
        "text": ";"
      }
    }
  ],
  "diagnostics": [],
  "roundTrip": {
    "ok": true,
    "bytes": 156,
    "sourceHash": "d8f41444b54973e2bc144b8b162df2d3aac05c3d5ec5529e53234b628f7599c4"
  },
  "parser": {
    "ok": true,
    "cypher": "/* generated by model */\nMATCH (tool:Tool {name: $toolName})-[:`has MD5 hash`]->(hash:Hash)\n// keep the projection exact\nRETURN hash.value AS md5 LIMIT 10;\n",
    "diagnostics": [],
    "rawDiagnostics": []
  },
  "irPreview": {
    "query": {
      "version": "cypher-llm-ir/v1",
      "profile": "raw-compatible",
      "clauses": [
        {
          "kind": "match",
          "patterns": [
            {
              "segments": [
                {
                  "variable": "tool",
                  "labels": [
                    "Tool"
                  ],
                  "properties": {
                    "name": {
                      "kind": "param",
                      "name": "toolName"
                    }
                  }
                },
                {
                  "rel": {
                    "types": [
                      "has MD5 hash"
                    ],
                    "direction": "out"
                  },
                  "node": {
                    "variable": "hash",
                    "labels": [
                      "Hash"
                    ]
                  }
                }
              ]
            }
          ]
        },
        {
          "kind": "return",
          "items": [
            {
              "expression": {
                "kind": "prop",
                "object": {
                  "kind": "var",
                  "name": "hash"
                },
                "key": "value"
              },
              "alias": "md5"
            }
          ],
          "limit": {
            "kind": "literal",
            "value": 10
          }
        }
      ]
    },
    "renderedCypher": "MATCH (tool:`Tool` {`name`: $toolName})-[:`has MD5 hash`]->(hash:`Hash`)\nRETURN hash.`value` AS md5\nLIMIT 10",
    "supportedClauses": 2,
    "rawClauses": 0,
    "parserOk": true,
    "diagnostics": []
  }
}
